{
  "review_record_id": "review_output_door_left_lit_branch_station_blocked_001",
  "project_id": "proj_door_left_lit",
  "review_role": "output_critic",
  "reviewer_execution": {
    "execution_mode": "bounded_sub_agent",
    "sub_agent_required": true,
    "source_skill": "artist-os-critique-asset"
  },
  "artifact_under_review": {
    "artifact_type": "output_record",
    "artifact_id": "out_door_left_lit_branch_station_001",
    "path_or_ref": "tests/fixtures/outputs/output-record.json"
  },
  "upstream_context": {
    "source_id": "src_door_left_lit",
    "artist_meaning_id": "meaning_door_left_lit",
    "artist_meaning_summary": "Preserve an unresolved threshold and held motion.",
    "governing_refs": [
      {
        "ref_type": "beat_plan",
        "ref_id": "bp_door_left_lit",
        "path_or_ref": "tests/fixtures/story/beat-plan.json"
      },
      {
        "ref_type": "medium_plan",
        "ref_id": "imp_door_left_lit",
        "path_or_ref": "tests/fixtures/text-to-image/image-medium-plan.json"
      },
      {
        "ref_type": "prompt_plan",
        "ref_id": "plan_door_left_lit",
        "path_or_ref": "tests/fixtures/text-to-image/prompt-plan.json"
      }
    ],
    "open_questions": []
  },
  "emotional_tension_review": {
    "intended_feeling_reviewed": "Preserve unresolved threshold pressure and held motion in the concrete output.",
    "minimum_tension_criteria_reviewed": [
      "The output must keep the threshold unresolved.",
      "The output must not resolve fragile agency into completed departure."
    ],
    "tension_intensity_assessments": [
      {
        "source_ref": "out_door_left_lit_branch_station_001",
        "tension_name": "unresolved threshold",
        "claimed_intensity": 0.72,
        "reviewer_assessed_intensity": 0.35,
        "minimum_required_intensity": 0.65,
        "meets_minimum": false,
        "assessment_note": "The completed departure collapses the required unresolved threshold, so the output falls below the minimum despite the artist waiver."
      }
    ],
    "key_emotional_movements_reviewed": [
      {
        "movement_id": "kem_threshold_001",
        "review_note": "The output breaks the compressed movement by resolving the suspended choice."
      }
    ],
    "expectation_turns_reviewed": [
      {
        "beat_id": "beat_threshold_001",
        "review_note": "The expected withheld return is not preserved because the figure has departed."
      }
    ],
    "missing_context": [],
    "reviewer_conclusion": "The output fails the emotional/tension contract; acceptance requires an explicit artist waiver."
  },
  "matched": [
    {
      "summary": "The output keeps the approved branch's station setting.",
      "traces_to": [
        {
          "source_type": "prompt_plan",
          "source_ref": "plan_door_left_lit",
          "note": "The output remains tied to the approved prompt plan lineage."
        }
      ]
    }
  ],
  "drifted": [
    {
      "drift_from": "Artist Meaning and Beat Plan",
      "where": "The output resolves the figure leaving the threshold instead of preserving held uncertainty.",
      "severity": "blocking",
      "artist_approved": false,
      "revision_needed": "Revise the output so the figure remains suspended at the threshold."
    }
  ],
  "findings": [
    {
      "severity": "blocking",
      "summary": "The output resolves the central tension.",
      "evidence": "The output description shows completed departure, which contradicts the required unresolved threshold.",
      "recommendation": "Block acceptance unless the artist explicitly waives this drift."
    }
  ],
  "recommended_revision": "Regenerate or revise with the figure held in the threshold state rather than departing.",
  "approval_status": "block",
  "artist_waiver": {
    "waived": true,
    "reason": "Artist explicitly wants to keep this resolved version as a useful alternate ending candidate.",
    "waived_by": "artist",
    "waived_at": "2026-06-06T12:12:00Z"
  },
  "created_at": "2026-06-06T12:11:00Z"
}
