{
  "review_record_id": "review_text_output_door_left_lit_draft_001",
  "project_id": "proj_door_left_lit",
  "review_role": "output_critic",
  "reviewer_execution": {
    "execution_mode": "bounded_sub_agent",
    "sub_agent_required": true,
    "source_skill": "artist-os-critique-asset"
  },
  "artifact_under_review": {
    "artifact_type": "output_record",
    "artifact_id": "out_text_door_left_lit_draft_001",
    "path_or_ref": "tests/fixtures/text-journey/output-record-draft.json"
  },
  "upstream_context": {
    "source_id": "src_door_left_lit",
    "artist_meaning_id": "meaning_door_left_lit",
    "artist_meaning_summary": "Preserve threshold, key, active absence, and an unresolved ending in the drafted written artifact.",
    "governing_refs": [
      {
        "ref_type": "beat_plan",
        "ref_id": "bp_door_left_lit",
        "path_or_ref": "tests/fixtures/story/beat-plan.json"
      },
      {
        "ref_type": "medium_plan",
        "ref_id": "tmp_door_left_lit",
        "path_or_ref": "tests/fixtures/text-journey/text-medium-plan.json"
      },
      {
        "ref_type": "text_creative_brief",
        "ref_id": "brief_text_door_left_lit",
        "path_or_ref": "tests/fixtures/text-journey/text-creative-brief.json"
      },
      {
        "ref_type": "text_generation_plan",
        "ref_id": "plan_text_door_left_lit",
        "path_or_ref": "tests/fixtures/text-journey/text-generation-plan.json"
      }
    ],
    "open_questions": []
  },
  "emotional_tension_review": {
    "intended_feeling_reviewed": "the ache of being close to release but unable to choose it",
    "minimum_tension_criteria_reviewed": [
      "The draft must preserve the unresolved ending.",
      "The draft must keep the key or equivalent object as fragile agency.",
      "The draft must not convert absence into a solved explanation."
    ],
    "tension_intensity_assessments": [
      {
        "source_ref": "out_text_door_left_lit_draft_001",
        "tension_name": "written threshold pressure",
        "claimed_intensity": 0.68,
        "reviewer_assessed_intensity": 0.69,
        "minimum_required_intensity": 0.65,
        "meets_minimum": true,
        "assessment_note": "The draft keeps the crossing withheld and treats the key as unresolved agency rather than a solved clue."
      }
    ],
    "key_emotional_movements_reviewed": [
      {
        "movement_id": "kem_threshold_001",
        "review_note": "The draft keeps the threshold movement as the central pressure."
      }
    ],
    "expectation_turns_reviewed": [
      {
        "beat_id": "beat_threshold_001",
        "review_note": "The expected entry or departure remains withheld in the final movement."
      }
    ],
    "missing_context": [],
    "reviewer_conclusion": "The draft is traceable to the Text Generation Plan and ready for Output Acceptance or optional editorial passes."
  },
  "matched": [
    {
      "summary": "The draft preserves the approved unresolved threshold and the fresh-context drafting boundary.",
      "traces_to": [
        {
          "source_type": "text_generation_plan",
          "source_ref": "plan_text_door_left_lit",
          "note": "The draft follows the locked Text Generation Plan and its source-wording policy."
        }
      ]
    }
  ],
  "drifted": [],
  "findings": [
    {
      "severity": "low",
      "summary": "Draft meets the output review threshold.",
      "evidence": "The Output Record carries the Text Generation Plan ref and the draft trace names the section-to-beat mapping.",
      "recommendation": "Proceed to Output Acceptance or optional editorial passes."
    }
  ],
  "recommended_revision": "No blocking revision required.",
  "approval_status": "approve",
  "artist_waiver": {
    "waived": false,
    "reason": "",
    "waived_by": null,
    "waived_at": null
  },
  "created_at": "2026-06-17T12:50:00Z"
}
