{
  "review_record_id": "review_story_sample_001",
  "project_id": "proj_sample_text_001",
  "review_role": "story_critic",
  "reviewer_execution": {
    "execution_mode": "bounded_sub_agent",
    "sub_agent_required": true,
    "source_skill": "artist-os-writing-method-review"
  },
  "artifact_under_review": {
    "artifact_type": "beat_plan",
    "artifact_id": "bp_sample_text_001",
    "path_or_ref": "examples/beat-plan.example.json"
  },
  "upstream_context": {
    "source_id": "src_sample_text",
    "artist_meaning_id": "meaning_sample_text_001",
    "artist_meaning_summary": "Preserve an unresolved threshold and held motion.",
    "governing_refs": [
      {
        "ref_type": "transformation_brief",
        "ref_id": "tb_sample_text_001",
        "path_or_ref": "examples/transformation-brief.example.json"
      },
      {
        "ref_type": "writing_reference",
        "ref_id": "writing-beats",
        "path_or_ref": "docs/writing/references/writing-beats.SKILL.md"
      }
    ],
    "open_questions": []
  },
  "emotional_tension_review": {
    "intended_feeling_reviewed": "Preserve unresolved threshold pressure and held motion.",
    "minimum_tension_criteria_reviewed": [
      "The beat must create pressure through withheld entry rather than factual description alone.",
      "The expectation turn must make closeness intensify uncertainty instead of resolving it."
    ],
    "tension_intensity_assessments": [
      {
        "source_ref": "beat_threshold_001",
        "tension_name": "withheld entry pressure",
        "claimed_intensity": 0.7,
        "reviewer_assessed_intensity": 0.72,
        "minimum_required_intensity": 0.65,
        "meets_minimum": true,
        "assessment_note": "The beat earns the claimed pressure because closeness increases uncertainty instead of resolving the threshold."
      }
    ],
    "key_emotional_movements_reviewed": [
      {
        "movement_id": "kem_threshold_001",
        "review_note": "The plan preserves one compressed emotional movement: approach becomes suspended choice."
      }
    ],
    "expectation_turns_reviewed": [
      {
        "beat_id": "beat_threshold_001",
        "review_note": "The expected return is withheld, creating the intended unresolved pressure."
      }
    ],
    "missing_context": [],
    "reviewer_conclusion": "The artifact has enough emotional and tension context to proceed."
  },
  "matched": [
    {
      "summary": "The Beat Plan keeps the work to one clear threshold move.",
      "traces_to": [
        {
          "source_type": "artist_meaning",
          "source_ref": "meaning_interview",
          "note": "The artist wanted unresolved threshold pressure."
        }
      ]
    }
  ],
  "drifted": [],
  "findings": [
    {
      "severity": "low",
      "summary": "The single beat is coherent.",
      "evidence": "The beat does one move: approach becomes held presence.",
      "recommendation": "Proceed to medium translation."
    }
  ],
  "recommended_revision": "No revision required before medium translation.",
  "approval_status": "approve",
  "artist_waiver": {
    "waived": false,
    "reason": "",
    "waived_by": null,
    "waived_at": null
  },
  "created_at": "2026-06-04T12:01:00Z"
}
